{
  "opening": "[SFX: time machine hum, 2s] [BGM: curious morning pulse, under narration] Good morning, time traveler. Before your backpack is even zipped, you are stepping into 2026-10-12. Today's mystery is A royal wedding plants the seed for Oktoberfest. Here is your first clue: How a wedding celebration for Ludwig and Therese became a public tradition that Munich still remembers Keep your ears open. In the next few minutes, you will hear how one moment can change the way you learn, play, or explore.",
  "segments": [
    {
      "heading": "Time Machine Hook",
      "body": "[SFX: soft bell chime] [Voice: excited whisper] Imagine you press a glowing button and land right beside A royal wedding plants the seed for Oktoberfest. What do you notice first? Is it a sound, a crowd, a room, a screen, or someone's nervous face? [Action: look around your room and point to one thing you would take in a time machine] The big idea for you to track is this: A community celebration can become history when people repeat it, reshape it, and attach it to a place. That idea is our map. You will use it to follow the clues."
    },
    {
      "heading": "Narrative Drama",
      "body": "[SFX: clock ticks faster] [BGM: light suspense, under narration] First clue: A child in Munich hears that a royal wedding is not only for palaces: ordinary people are invited to celebrate too Then the pressure builds: The party moves to a meadow outside the city, where a horse race turns a wedding into a public memory Finally, the moment opens up: The meadow receives a name connected to Princess Therese, and the place itself becomes part of the story The timeline gives you the trail: October 12, 1810: Crown Prince Ludwig of Bavaria marries Princess Therese of Saxe-Hildburghausen Then, October 17, 1810: Official wedding festivities end with a public horse race on a meadow outside Munich Then, 1811: The Bavarian Agricultural Association helps continue the festival as a yearly event Then, 1819: Munich's city leaders take over organization of the Oktoberfest Then, 1872: Oktoberfest is moved earlier into September to take advantage of milder weather. If you were there, what question would you ask first? You might ask who was scared, who was excited, and who had to solve the next problem."
    },
    {
      "heading": "Scientific Deep-Dive",
      "body": "[SFX: magnifying glass sparkle] [Pause 1s] Now we slow down and investigate the hidden machinery of the story. Think of A royal wedding plants the seed for Oktoberfest like a school hallway between classes. A hallway only works when doors, signs, and people help you move without getting lost. In the same way, this story works because A community celebration can become history when people repeat it, reshape it, and attach it to a place. That metaphor matters because you can test it yourself: when something is well designed, your brain spends less energy guessing and more energy learning. So when you hear a big historical event, do not only ask what happened. Ask how it helped people make their next move."
    },
    {
      "heading": "Modern World Twist",
      "body": "[SFX: phone tap, tablet swipe] [BGM: bright discovery beat, under narration] Here is where the story reaches your world: Modern festivals, school traditions, parades, and annual community events often begin the same way: one shared moment works so well that people decide to bring it back. You can spot that connection when you open an app, visit a museum, follow a map, search for a file, or ask an adult a better question. Your daily life is full of tiny choices someone designed before you arrived. When you notice those choices, you stop being only a user. You become an investigator. What would you improve if you could redesign one tool you use every day?"
    },
    {
      "heading": "Outro & Mission",
      "body": "[SFX: time machine landing tone] Mission time. Today, your job is to explain A royal wedding plants the seed for Oktoberfest to someone at home in one sentence. Use this frame: it mattered because it helped people do something in a new way. [Action: tap your fingers twice if you found the main clue] Then ask your listener what everyday object they think will become history someday. That question keeps your curiosity moving after the episode ends."
    }
  ],
  "closing": "[BGM: warm closing theme, under narration] [SFX: time machine powers down] You made it back to today. Now you know why A royal wedding plants the seed for Oktoberfest is more than a date on a calendar. It is a clue about how people solve problems, share ideas, and build the world you use every day. See you next time, time traveler.",
  "estimatedDurationMin": 6,
  "ttsNotes": [
    "Pronunciation: read \"A royal wedding plants the seed for Oktoberfest\" slowly and clearly on first mention.",
    "Phonetic support: pause briefly before dates and proper nouns.",
    "Humanizer pass marker: reviewed for natural spoken phrasing, short sentences, and read-aloud flow."
  ]
}
