{
  "opening": "[SFX: time machine hum, 2s] [BGM: curious morning pulse, under narration] Good morning, time traveler. Before your backpack is even zipped, you are stepping into 2026-10-02. Today's mystery is The first Peanuts comic strip is published. Here is your first clue: How four small newspaper panels introduced Charlie Brown and helped children see big feelings in simple drawings Keep your ears open. In the next few minutes, you will hear how one moment can change the way you learn, play, or explore.",
  "segments": [
    {
      "heading": "Time Machine Hook",
      "body": "[SFX: soft bell chime] [Voice: excited whisper] Imagine you press a glowing button and land right beside The first Peanuts comic strip is published. What do you notice first? Is it a sound, a crowd, a room, a screen, or someone's nervous face? [Action: look around your room and point to one thing you would take in a time machine] The big idea for you to track is this: A simple comic strip can last for generations when it makes everyday worries, friendship, and persistence feel recognizable. That idea is our map. You will use it to follow the clues."
    },
    {
      "heading": "Narrative Drama",
      "body": "[SFX: clock ticks faster] [BGM: light suspense, under narration] First clue: A young listener opens a 1950 newspaper and finds a tiny four-panel strip instead of a loud headline Then the pressure builds: Charlie Brown appears before his famous zigzag shirt, and Snoopy is still a small dog who walks on all fours Finally, the moment opens up: Schulz turns ordinary feelings, such as embarrassment, hope, and trying again, into jokes children can understand The timeline gives you the trail: Spring 1950: Charles M. Schulz sells his newspaper cartoon idea to United Feature Syndicate after earlier rejections Then, Summer 1950: The syndicate renames Schulz's strip Peanuts before publication, a title Schulz later said he disliked Then, October 2, 1950: The first Peanuts comic strip debuts in a four-panel format in seven newspapers nationwide Then, December 21, 1950: Charlie Brown first appears in his now-famous zigzag shirt Then, January 6, 1952: The first full-color Sunday Peanuts strips are introduced. If you were there, what question would you ask first? You might ask who was scared, who was excited, and who had to solve the next problem."
    },
    {
      "heading": "Scientific Deep-Dive",
      "body": "[SFX: magnifying glass sparkle] [Pause 1s] Now we slow down and investigate the hidden machinery of the story. Think of The first Peanuts comic strip is published like a school hallway between classes. A hallway only works when doors, signs, and people help you move without getting lost. In the same way, this story works because A simple comic strip can last for generations when it makes everyday worries, friendship, and persistence feel recognizable. That metaphor matters because you can test it yourself: when something is well designed, your brain spends less energy guessing and more energy learning. So when you hear a big historical event, do not only ask what happened. Ask how it helped people make their next move."
    },
    {
      "heading": "Modern World Twist",
      "body": "[SFX: phone tap, tablet swipe] [BGM: bright discovery beat, under narration] Here is where the story reaches your world: Modern comics, animation, stickers, memes, and short visual stories still use the same basic power Peanuts showed: a few clear drawings can help people name complicated feelings. You can spot that connection when you open an app, visit a museum, follow a map, search for a file, or ask an adult a better question. Your daily life is full of tiny choices someone designed before you arrived. When you notice those choices, you stop being only a user. You become an investigator. What would you improve if you could redesign one tool you use every day?"
    },
    {
      "heading": "Outro & Mission",
      "body": "[SFX: time machine landing tone] Mission time. Today, your job is to explain The first Peanuts comic strip is published to someone at home in one sentence. Use this frame: it mattered because it helped people do something in a new way. [Action: tap your fingers twice if you found the main clue] Then ask your listener what everyday object they think will become history someday. That question keeps your curiosity moving after the episode ends."
    }
  ],
  "closing": "[BGM: warm closing theme, under narration] [SFX: time machine powers down] You made it back to today. Now you know why The first Peanuts comic strip is published is more than a date on a calendar. It is a clue about how people solve problems, share ideas, and build the world you use every day. See you next time, time traveler.",
  "estimatedDurationMin": 6,
  "ttsNotes": [
    "Pronunciation: read \"The first Peanuts comic strip is published\" slowly and clearly on first mention.",
    "Phonetic support: pause briefly before dates and proper nouns.",
    "Humanizer pass marker: reviewed for natural spoken phrasing, short sentences, and read-aloud flow."
  ]
}
