{
  "opening": "[SFX: time machine hum, 2s] [BGM: curious morning pulse, under narration] Good morning, time traveler. Before your backpack is even zipped, you are stepping into 2026-10-01. Today's mystery is Ford Model T goes on sale. Here is your first clue: How a lower-priced, practical car helped families imagine travel beyond horses, streetcars, and trains Keep your ears open. In the next few minutes, you will hear how one moment can change the way you learn, play, or explore.",
  "segments": [
    {
      "heading": "Time Machine Hook",
      "body": "[SFX: soft bell chime] [Voice: excited whisper] Imagine you press a glowing button and land right beside Ford Model T goes on sale. What do you notice first? Is it a sound, a crowd, a room, a screen, or someone's nervous face? [Action: look around your room and point to one thing you would take in a time machine] The big idea for you to track is this: A machine can change daily life when engineers make it simple, durable, and cheaper for ordinary families to use. That idea is our map. You will use it to follow the clues."
    },
    {
      "heading": "Narrative Drama",
      "body": "[SFX: clock ticks faster] [BGM: light suspense, under narration] First clue: A child in 1908 sees streets where horses, wagons, streetcars, and a few noisy automobiles all share the road Then the pressure builds: The Model T promises a car sturdy enough for rough roads and simple enough for more people to drive Finally, the moment opens up: Its falling price helps explain why cars moved from rare luxury machines toward everyday family transportation The timeline gives you the trail: October 1, 1908: Ford introduces the Model T automobile Then, 1908: The Model T is sold for about $850, still expensive but lower than many luxury cars of the time Then, 1913-1914: Ford's moving assembly line helps reduce production time and pushes Model T prices downward Then, 1927: Ford ends Model T production after building more than 15 million cars. If you were there, what question would you ask first? You might ask who was scared, who was excited, and who had to solve the next problem."
    },
    {
      "heading": "Scientific Deep-Dive",
      "body": "[SFX: magnifying glass sparkle] [Pause 1s] Now we slow down and investigate the hidden machinery of the story. Think of Ford Model T goes on sale like a school hallway between classes. A hallway only works when doors, signs, and people help you move without getting lost. In the same way, this story works because A machine can change daily life when engineers make it simple, durable, and cheaper for ordinary families to use. That metaphor matters because you can test it yourself: when something is well designed, your brain spends less energy guessing and more energy learning. So when you hear a big historical event, do not only ask what happened. Ask how it helped people make their next move."
    },
    {
      "heading": "Modern World Twist",
      "body": "[SFX: phone tap, tablet swipe] [BGM: bright discovery beat, under narration] Here is where the story reaches your world: Modern debates about gasoline cars, electric vehicles, city design, traffic, and family mobility still trace back to the moment cars became practical mass-market transportation. You can spot that connection when you open an app, visit a museum, follow a map, search for a file, or ask an adult a better question. Your daily life is full of tiny choices someone designed before you arrived. When you notice those choices, you stop being only a user. You become an investigator. What would you improve if you could redesign one tool you use every day?"
    },
    {
      "heading": "Outro & Mission",
      "body": "[SFX: time machine landing tone] Mission time. Today, your job is to explain Ford Model T goes on sale to someone at home in one sentence. Use this frame: it mattered because it helped people do something in a new way. [Action: tap your fingers twice if you found the main clue] Then ask your listener what everyday object they think will become history someday. That question keeps your curiosity moving after the episode ends."
    }
  ],
  "closing": "[BGM: warm closing theme, under narration] [SFX: time machine powers down] You made it back to today. Now you know why Ford Model T goes on sale is more than a date on a calendar. It is a clue about how people solve problems, share ideas, and build the world you use every day. See you next time, time traveler.",
  "estimatedDurationMin": 6,
  "ttsNotes": [
    "Pronunciation: read \"Ford Model T goes on sale\" slowly and clearly on first mention.",
    "Phonetic support: pause briefly before dates and proper nouns.",
    "Humanizer pass marker: reviewed for natural spoken phrasing, short sentences, and read-aloud flow."
  ]
}
