{
  "opening": "[SFX: time machine hum, 2s] [BGM: curious morning pulse, under narration] Good morning, time traveler. Before your backpack is even zipped, you are stepping into 2026-10-03. Today's mystery is The launch of Windows 95. Here is your first clue: How a software launch helped make personal computers feel easier for everyday families Keep your ears open. In the next few minutes, you will hear how one moment can change the way you learn, play, or explore.",
  "segments": [
    {
      "heading": "Time Machine Hook",
      "body": "[SFX: soft bell chime] [Voice: excited whisper] Imagine you press a glowing button and land right beside The launch of Windows 95. What do you notice first? Is it a sound, a crowd, a room, a screen, or someone's nervous face? [Action: look around your room and point to one thing you would take in a time machine] The big idea for you to track is this: A computer interface can change how people learn, work, and explore at home. That idea is our map. You will use it to follow the clues."
    },
    {
      "heading": "Narrative Drama",
      "body": "[SFX: clock ticks faster] [BGM: light suspense, under narration] First clue: Families and computer stores wait for a midnight software launch Then the pressure builds: A new Start button and taskbar make computers feel more approachable Finally, the moment opens up: The launch shows how software can change daily habits The timeline gives you the trail: August 24, 1995: Microsoft launches Windows 95 Then, 1995: Windows 95 introduces the Start button, taskbar, desktop shortcuts, and plug and play support Then, First five weeks after launch: Microsoft reports 7 million copies sold. If you were there, what question would you ask first? You might ask who was scared, who was excited, and who had to solve the next problem."
    },
    {
      "heading": "Scientific Deep-Dive",
      "body": "[SFX: magnifying glass sparkle] [Pause 1s] Now we slow down and investigate the hidden machinery of the story. Think of The launch of Windows 95 like a school hallway between classes. A hallway only works when doors, signs, and people help you move without getting lost. In the same way, this story works because A computer interface can change how people learn, work, and explore at home. That metaphor matters because you can test it yourself: when something is well designed, your brain spends less energy guessing and more energy learning. So when you hear a big historical event, do not only ask what happened. Ask how it helped people make their next move."
    },
    {
      "heading": "Modern World Twist",
      "body": "[SFX: phone tap, tablet swipe] [BGM: bright discovery beat, under narration] Here is where the story reaches your world: Modern phones, tablets, and laptops still depend on interface choices that help people find apps, files, and settings. You can spot that connection when you open an app, visit a museum, follow a map, search for a file, or ask an adult a better question. Your daily life is full of tiny choices someone designed before you arrived. When you notice those choices, you stop being only a user. You become an investigator. What would you improve if you could redesign one tool you use every day?"
    },
    {
      "heading": "Outro & Mission",
      "body": "[SFX: time machine landing tone] Mission time. Today, your job is to explain The launch of Windows 95 to someone at home in one sentence. Use this frame: it mattered because it helped people do something in a new way. [Action: tap your fingers twice if you found the main clue] Then ask your listener what everyday object they think will become history someday. That question keeps your curiosity moving after the episode ends."
    }
  ],
  "closing": "[BGM: warm closing theme, under narration] [SFX: time machine powers down] You made it back to today. Now you know why The launch of Windows 95 is more than a date on a calendar. It is a clue about how people solve problems, share ideas, and build the world you use every day. See you next time, time traveler.",
  "estimatedDurationMin": 6,
  "ttsNotes": [
    "Pronunciation: read \"The launch of Windows 95\" slowly and clearly on first mention.",
    "Phonetic support: pause briefly before dates and proper nouns.",
    "Humanizer pass marker: reviewed for natural spoken phrasing, short sentences, and read-aloud flow."
  ]
}
